{
    "aanvrager": {
        "naam": "Sophie de Boer"
    },
    "adres": "Lange Voorhout 12, 2514 ED Den Haag",
    "status": "in_behandeling",
    "aantalKamers": 4,
    "opmerking": "Inspectie aangevraagd",
    "migratedFrom": "1.0.0",
    "inspectieAangevraagd": true,
    "inspectieStatus": "gepland"
}
